{
  "requestId": "verification-request-credential-001",
  "messageVersion": "reference-v1",
  "relyingPartyId": "relying-party:example:merchant",
  "agentId": "agent:example:shopping-assistant",
  "verificationLevel": "CREDENTIAL",
  "purpose": "MERCHANT_RISK_REFERENCE",
  "businessContext": {
    "orderId": "order-example-001",
    "transactionType": "PURCHASE"
  },
  "requestedDataItems": [
    "credentialStatus",
    "confirmationMethod"
  ],
  "credential": {
    "credentialId": "credential-attested-001",
    "uri": "https://issuer.example/credentials/credential-attested-001"
  },
  "requestedAt": "2026-08-12T08:21:00Z",
  "antiReplay": {
    "nonce": "verification-nonce-credential-001"
  },
  "requestProof": {
    "signatureAlgorithm": "Ed25519",
    "keyId": "relying-party:example:merchant#key-1",
    "signatureValue": "CREDENTIAL_VERIFICATION_REQUEST_TEST_SIGNATURE"
  }
}
